{
  "_comment": "SEQTRAK実機での実測に基づく確定マッピング。Phase 0 (midi-monitor/) で計測。velocity_range/value_range は実測時の1サンプルのみを反映しており、Phase 1以降でより多くの叩き方・操作幅を計測して広げること。",
  "generated_at": "2026-08-30T11:54:03.066Z",
  "delay_compensation_ms": 0,
  "notes": [
    { "name": "KICK",             "channel": 1,  "note": 60, "velocity_range": [100, 100], "cluster": 0,    "role": "cluster_trigger", "tau": 0.12 },
    { "name": "KICK_CAMERA_KICK", "channel": 1,  "note": 60, "velocity_range": [100, 100], "cluster": null, "role": "camera_kick",     "tau": 0.10 },
    { "name": "SNARE",            "channel": 2,  "note": 60, "velocity_range": [100, 100], "cluster": 1,    "role": "cluster_trigger", "tau": 0.15 },
    { "name": "CLAP",             "channel": 3,  "note": 60, "velocity_range": [100, 100], "cluster": 1,    "role": "cluster_trigger", "tau": 0.15 },
    { "name": "HAT_CLOSE",        "channel": 4,  "note": 60, "velocity_range": [100, 100], "cluster": 2,    "role": "cluster_trigger", "tau": 0.08 },
    { "name": "HAT_OPEN",         "channel": 5,  "note": 60, "velocity_range": [100, 100], "cluster": 2,    "role": "cluster_trigger", "tau": 0.12 },
    { "name": "PERC_1",           "channel": 6,  "note": 60, "velocity_range": [100, 100], "cluster": 3,    "role": "cluster_trigger", "tau": 0.08 },
    { "name": "PERC_2",           "channel": 7,  "note": 60, "velocity_range": [100, 100], "cluster": 3,    "role": "cluster_trigger", "tau": 0.08 },
    { "name": "SYNTH_1",          "channel": 8,  "note": 50, "velocity_range": [100, 100], "cluster": null, "role": "hue_shift",       "tau": 0.30 },
    { "name": "SYNTH_2",          "channel": 9,  "note": 50, "velocity_range": [100, 100], "cluster": null, "role": "hue_shift",       "tau": 0.30 },
    { "name": "DX",               "channel": 10, "note": 86, "velocity_range": [100, 100], "cluster": null, "role": "bloom_spike",     "tau": 0.20 },
    { "name": "SAMPLER",          "channel": 11, "note": 60, "velocity_range": [100, 100], "cluster": null, "role": "scene_cut",       "tau": 0.00 }
  ],
  "control_changes": [
    { "name": "HIGH_PASS", "channel": 1,  "cc_number": 105, "value_range": [0, 55],  "target": "dof_focus_distance" },
    { "name": "REPEATER",  "channel": 1,  "cc_number": 106, "value_range": [0, 77],  "target": "camera_amplitude" },
    { "name": "FX_LEVEL",  "channel": 11, "cc_number": 107, "value_range": [36, 84], "target": "bloom_amount" }
  ]
}
